is.language,Language name,,Popular name for the language of the resource,Select from control list,,GLOBAL,Form,SINGLE SELECT FROM CONTROL LIST,ISEAL,CONTROLLED VALUE,
is.coverage.latitude,Latitude location coordinate for the resource or its focus,,"Use for polygons, shapes, study sites etc. Latitude location coordinates should be recorded in decimal degrees (DD). Recording 4 digits to the right of the decimal provides an accuracy of 10m",Example of a latitude in Bolivia: -16.9013,,GLOBAL,Coverage,SINGLE VALUE ONLY,ISEAL,GEO VALUE,
is.link.url,Link to a URL,,Internet link to any other associated item,"Try to always link to any standard and permament identifier (eg, not a PDF). Data element used by Evidensia",,GLOBAL,Form,REPEAT VALUES,ISEAL,URL,
is.link.image,"Link to an image, photo or other multimedia",,Internet link to an associated image,Data element used by Evidensia,,GLOBAL,Form,REPEAT VALUES,ISEAL,URL,
is.coverage.longitude,Longitude location coordinate for the resource or its focus,,"Use for polygons, shapes, study sites etc. Longitude location coordinates should be recorded in decimal degrees (DD). Recording 4 digits to the right of the decimal provides an accuracy of 10m",Example of a longitude in Bolivia: -62.0244,,GLOBAL,Coverage,SINGLE VALUE ONLY,ISEAL,GEO VALUE,
dcterms.description,Notes,,An account of the resource,Any additional information about the resource not covered in any other element,,GLOBAL,Form,SINGLE VALUE ONLY,ISEAL,FREE VALUE,
is.extent.number,Number,,"Journal article issue number, series number, or any other identifying number",,,GLOBAL,Form,SINGLE VALUE ONLY,ISEAL,FREE VALUE,
is.organization.bluenumber,Organization Bluenumber ID,,,,https://bluenumber.org/,GLOBAL,Provenance,REPEAT VALUES,ISEAL,FREE VALUE,
is.organization.ror,Organization ROR ID,,ROR ID for an organization,Assign for resources associated to organizations,https://ror.org/,GLOBAL,Provenance,REPEAT VALUES,ISEAL,FREE VALUE,
dcterms.alternative,Other titles,,Alternative name for the resource,"eg, the title another language; Only if explicitly mentioned on the resource",,GLOBAL,Provenance,SINGLE VALUE ONLY,dublin core,FREE VALUE,https://www.dublincore.org/specifications/dublin-core/dcmi-terms/terms/alternative/
is.extent.pages,Pagination,,Start/end pagination of a journal article or chapter,,,GLOBAL,Form,SINGLE VALUE ONLY,ISEAL,FREE VALUE,
is.item.reviewStatus,Peer review status,,Whether the resource has been peer reviewed,Select from control list,,GLOBAL,Status,SINGLE SELECT FROM CONTROL LIST,ISEAL,CONTROLLED VALUE,
is.coverage.place,Place name,,"Name(s) of specific places, sites, towns, cities, districts, etc. that the resource is about",,,GLOBAL,Coverage,REPEAT VALUES,ISEAL,GEO VALUE,
is.focus.products,Product focus,,Certified commodites or products,Select from control list. Data element used by Evidensia,,GLOBAL,Scope,MULTI SELECT FROM CONTROL LIST,ISEAL,CONTROLLED VALUE,
is.item.publicationPlace,Publication place,,City and country name,"Usually entered as: City, country",,GLOBAL,Provenance,SINGLE VALUE ONLY,ISEAL,FREE VALUE,
dcterms.publisher,Publisher,mandatory,Entity or entities responsible for making the resource available.,Usually the name of an organization. Use resources like ROR. Data element used by Evidensia,https://ror.org/,GLOBAL,Provenance,REPEAT VALUES,dublin core,FREE VALUE,https://www.dublincore.org/specifications/dublin-core/dcmi-terms/terms/publisher/
is.coverage.region,Region name,,Region where data was collected or the focus of the research described in the resource. Terms should be in UN M.49 format,Select from control list,https://unstats.un.org/unsd/methodology/m49/,GLOBAL,Coverage,MULTI SELECT FROM CONTROL LIST,ISEAL,CONTROLLED VALUE,
is.focus.sdg,SDG focus,,Sustainable development goal(s) associated to the resource,Select from control list. Data element used by Evidensia,,GLOBAL,Scope,MULTI SELECT FROM CONTROL LIST,ISEAL,CONTROLLED VALUE,
is.focus.sectors,Sector focus,,Sectors that the resource covers,Select from control list. Data element used by Evidensia,https://www.oecd.org/dac/financing-sustainable-development/development-finance-standards/dacandcrscodelists.htm,GLOBAL,Scope,MULTI SELECT FROM CONTROL LIST,ISEAL,CONTROLLED VALUE,
dcterms.isPartOf,Series name,,A related resource or series of resources in which the described resource is physically or logically included,Only if explicitly mentioned on the resource,,GLOBAL,Provenance,SINGLE VALUE ONLY,dublin core,FREE VALUE,https://www.dublincore.org/specifications/dublin-core/dcmi-terms/terms/isPartOf/
is.dateOfVersion1,Standard date of version 1,,Date when version 1 of a standard was first issued,"Date in YYYY-MM-DD format. At the very least you must enter the year, but month and day is better if possible.",,GLOBAL,Status,SINGLE VALUE ONLY,FSC,DATE,
dcterms.valid,Standard effective date,,Effective date of a code/standard or other resource,"Date in YYYY-MM-DD format. At the very least you must enter the year, but month and day is better if possible.",,GLOBAL,Status,SINGLE VALUE ONLY,dublin core,DATE,https://www.dublincore.org/specifications/dublin-core/dcmi-terms/terms/valid/
is.identifier.standardCode,Standard ID or code,,Official code describing or assigned to a standard,"For example ""FSC-DIR-40-004"".",,GLOBAL,Scope,REPEAT VALUES,ISEAL,FREE VALUE,
is.identifier.standardStatus,Standard status,,Status of development of a standard,Select from control list,,GLOBAL,Status,SINGLE SELECT FROM CONTROL LIST,ISEAL,CONTROLLED VALUE,
is.item.status,Status,mandatory,Stage the resource has reached,Select from control list,,GLOBAL,Status,SINGLE SELECT FROM CONTROL LIST,ISEAL,CONTROLLED VALUE,
dcterms.subject,Subject focus,,Keywords that help to describe the resource content or coverage. The topic or thematic focus of the resource.,Select from control list,,GLOBAL,Scope,REPEAT VALUES,dublin core,FREE VALUE,
is.focus.sustainLens,Sustainability cross-cutting lens,,,Select from control list. Data element used by Evidensia,,GLOBAL,Scope,MULTI SELECT FROM CONTROL LIST,Evidensia,CONTROLLED VALUE,
is.focus.sustainDimension,Sustainability dimension,,Primary sustainability focus of the the resource,Select from control list. Data element used by Evidensia,,GLOBAL,Scope,MULTI SELECT FROM CONTROL LIST,Evidensia,CONTROLLED VALUE,
is.focus.sustainIssue,Sustainability issue,,Specific sustainability issue(s) covered in the resource,Select from control list. Data element used by Evidensia,,GLOBAL,Scope,MULTI SELECT FROM CONTROL LIST,Evidensia,CONTROLLED VALUE,
is.focus.sustainOutcome,Sustainability outcome,,Specific sustainability outcome(s) covered in the resource,Select from control list. Data element used by Evidensia,,GLOBAL,Scope,MULTI SELECT FROM CONTROL LIST,Evidensia,CONTROLLED VALUE,
is.identifier.schemeName,Sustainability scheme name,,Name of certification scheme or body associated with the resource,Select from control list,,GLOBAL,Scope,MULTI SELECT FROM CONTROL LIST,ISEAL,CONTROLLED VALUE,
is.identifier.schemeType,Sustainability scheme type,,The approach that best characterizes the sustainability scheme covered by the resource,Select from control list. Data element used by Evidensia,,GLOBAL,Scope,MULTI SELECT FROM CONTROL LIST,ISEAL,CONTROLLED VALUE,
dc.title,Title,mandatory,Full official name given to a resource,Note: using legacy “dc” namespace due to limitations with the DSpace institutional repository software. Data element used by Evidensia,,GLOBAL,Provenance,SINGLE VALUE ONLY,dublin core,FREE VALUE,https://www.dublincore.org/specifications/dublin-core/dcmi-terms/terms/title/
dcterms.type,Type,mandatory,"Nature, type or genre of the resource",Select from control list,,GLOBAL,Form,SINGLE SELECT FROM CONTROL LIST,dublin core,CONTROLLED VALUE,https://www.dublincore.org/specifications/dublin-core/dcmi-terms/terms/type/
dc.identifier.uri,Uniform Resource Identifier,,"Usually assigned by a repository, eg a handle address in a DSpace repository",Note: using legacy “dc” namespace due to limitations with the DSpace institutional repository software.,,GLOBAL,Form,SINGLE VALUE ONLY,dublin core,URL,https://www.dublincore.org/specifications/dublin-core/dcmi-terms/terms/identifier/
dcterms.rightsHolder,Usage license holder,,Person(s) or organization(s) owning or managing rights over a resource,License holder of the resource,,GLOBAL,Form,SINGLE VALUE ONLY,dublin core,FREE VALUE,https://www.dublincore.org/specifications/dublin-core/dcmi-terms/terms/rightsHolder/
dcterms.license,Usage rights license,,Legal document giving official permission to do something with a resource,"Normally the type of license, indicated by a short name/code - Select from control list",,GLOBAL,Form,SINGLE SELECT FROM CONTROL LIST,dublin core,CONTROLLED VALUE,https://www.dublincore.org/specifications/dublin-core/dcmi-terms/terms/license/
is.extent.version,Version number,,Version number of a resource,Only if explicitly mentioned on the resource,,GLOBAL,Status,SINGLE VALUE ONLY,ISEAL,FREE VALUE,
is.extent.volume,Volume number,,Journal article volume number,,,GLOBAL,Form,SINGLE VALUE ONLY,ISEAL,FREE VALUE,
is.focus.gtin,Product GTIN,,Global Trade Item Numbers of products and items traded,Mainly used with barcodes assigned to products,https://www.gtin.info,GLOBAL,Scope,REPEAT VALUES,ITC,FREE VALUE,
